{
  "schema_version": 1,
  "starter_pack_version": "0.2.0",
  "updated_at": "2026-10-09T00:00:00Z",
  "environment": {
    "device": "phone",
    "os": null,
    "harness": "unknown_until_detected",
    "remote_access_ready": false
  },
  "phase": {
    "current": "phase-1",
    "status": "in_progress",
    "requirements_revision": "2026-10-09"
  },
  "steps": {
    "get-started": {
      "status": "completed",
      "updated_at": "2026-09-10T00:00:00Z",
      "notes": []
    },
    "primary-ai-phone-app": {
      "status": "not_started",
      "updated_at": "2026-09-10T00:00:00Z",
      "notes": []
    },
    "github-mobile": {
      "status": "not_started",
      "updated_at": "2026-09-10T00:00:00Z",
      "notes": []
    },
    "core-accounts": {
      "status": "in_progress",
      "updated_at": "2026-09-10T00:00:00Z",
      "notes": []
    },
    "instant-build": {
      "status": "not_started",
      "updated_at": "2026-09-10T00:00:00Z",
      "notes": []
    }
  },
  "choices": {
    "development_email": {
      "account_email": null,
      "notification_email": null,
      "access_email": null,
      "service_overrides": {"neon": "Signed in with GitHub"},
      "notes": ["Synthetic example: email preferences deferred; do not repeat intake."]
    },
    "service_auth": {
      "neon": {
        "method": "oauth",
        "provider": "github",
        "account_handle": "example-learner",
        "account_email": null,
        "source": "learner_report"
      }
    }
  },
  "artifacts": {"phase_history": []}
}
