{
  "schema_version": 1,
  "starter_pack_version": "0.2.0",
  "updated_at": "2026-10-09T00:00:00Z",
  "environment": {
    "device": "phone",
    "os": null,
    "harness": "unknown_until_detected",
    "remote_access_ready": false
  },
  "phase": {
    "current": "phase-1",
    "status": "not_started",
    "requirements_revision": "2026-10-09"
  },
  "steps": {},
  "choices": {},
  "artifacts": {"phase_history": []}
}
